,raw-group,summarized-query
0,"Rudy Giuliani, Donald Trump, Disbarment, Mayor of New York City",Giuliani Trump Disbarment NYC
1,"Jeffrey Epstein, Grand jury, Florida",Epstein Grand Jury Florida
2,"Electronic cigarette, Supreme Court of the United States, Food and Drug Administration",E-Cigarette Supreme Court FDA
3,"Stock, Jerome Powell, Interest rate",Powell Stock Interest Rate
4,"NATO summit, Washington",NATO Summit Washington
5,"Supreme Court of the United States, Social media, Joe Biden",SCOTUS Social Media Biden
6,"Supreme Court of the United States, Donald Trump, Riot",SCOTUS Trump Riot
7,"Supreme Court of the United States, Assault weapon, Second Amendment to the United States Constitution, Federal Assault Weapons Ban",SCOTUS Assault Weapon Ban
8,"Netherlands, Dick Schoof, Geert Wilders, Government, Far-right politics",Netherlands Wilders Government
