,raw-group,summarized-query
0,"Inflation, Personal consumption expenditures price index, Federal Reserve System",Inflation PCE Fed
1,"Joe Biden, Debate, Donald Trump, Democratic Party, United States presidential debates",Biden Trump Debate
2,"Robert F. Kennedy Jr., North Carolina, Ballot, Ballot access, Cornel West, Democratic Party",RFK Jr North Carolina Ballot
3,"Jill Biden, Joe Biden, Abortion, First Lady of the United States",Biden Abortion First Lady
4,"California, Gavin Newsom, United States Congress, Democratic Party",California Newsom Congress Democratic
5,"Democratic Party, George Latimer, Primary election, New York's 16th Congressional District, AIPAC",Latimer NY 16th Primary
6,"United States Senate, Michigan, China, Democratic Party, Elissa Slotkin, Republican Party, Debbie Stabenow",Senate Michigan China Slotkin Stabenow
7,"Nikki Haley, Donald Trump Jr., Republican Party, Vice President of the United States, Joe Biden",Haley Trump Jr VP Biden
8,"Republican National Convention, Republican Party, Milwaukee",RNC Republican Party Milwaukee
