,raw-group,summarized-query
0,"Joe Biden, Supreme Court of the United States, Donald Trump, Mar-a-Lago Club",Biden Trump Supreme Court
1,"John Roberts, Supreme Court of the United States, Chief Justice",Roberts SCOTUS Chief Justice
2,"Supreme Court of the United States, SCOTUSblog, July 1",SCOTUS July 1
3,"Supreme Court of the United States, Law",US Supreme Court Law
4,Supreme Court of the United States,US Supreme Court
5,"Supreme Court of the United States, Associated Press",SCOTUS AP
6,"Supreme Court of the United States, Corruption",US Supreme Court Corruption
7,"Supreme Court of the United States, Georgia Public Service Commission, Georgia",US Supreme Court Georgia Commission
