queries,response
"Los Angeles Sparks, Las Vegas Aces, WNBA, Dearica Hamby",0
"Gabriel Attal, Prime Minister of France, France",0
"John Deere Classic, PGA TOUR, TPC Deere Run",0
"Texas Rangers, Major League Baseball All-Star Game, Bruce Bochy, American League All-Star Team, American League, MLB",0
"Texas Rangers, Marcus Semien, Tampa Bay Rays",0
"Colorado Rockies, Kansas City Royals, Brenton Doyle, Austin Gomber, Seth Lugo",0
"Margot Robbie, Tom Ackerley, Barbie",0
"Fluminense FC, Fortaleza Esporte Clube, Campeonato Brasileiro Série A",0
"Atlanta Braves, Philadelphia Phillies, Marcell Ozuna, Ozzie Albies",0
"Olivier Faure, Socialist Party, Emmanuel Macron, Pension, France",0
"Esporte Clube Juventude, Grêmio FBPA, Campeonato Brasileiro Série A, Esporte Clube Bahia",0
"New York Mets, Pittsburgh Pirates, Francisco Lindor, Aroldis Chapman, Pittsburgh",0
"Detroit Tigers, Cincinnati Reds",0
"IndyCar Series, Mid-Ohio Sports Car Course, Álex Palou, Pato O'Ward, Indy 200 at Mid-Ohio, Hybrid vehicle",0
"Willie Nelson, Outlaw country, Willie Nelson's Fourth of July Picnic",0
"Arizona Diamondbacks, San Diego Padres, MLB",0
"Cleveland Guardians, San Francisco Giants, Bo Naylor, MLB, American League Central",0
"Jean-Luc Mélenchon, La France Insoumise, Left-wing politics, Emmanuel Macron, National Rally",0
"Seattle Mariners, Toronto Blue Jays, Center fielder",0
"C.F. Pachuca, C.F. Monterrey, Liga MX",0
"NASA, Asteroid, Earth, Asteroid impact avoidance, Planetary Defense Coordination Office, near-Earth object, Impact event",0
"Jesse Jane, Drug overdose, Pornographic film actor",0
"North Carolina Courage, National Women's Soccer League, WakeMed Soccer Park",0
"Emmanuel Macron, President of France",0
"Gwyneth Paltrow, Derek Blasberg, Diarrhea, Goop, Gossip",0
"Shane van Gisbergen, NASCAR Cup Series, Chicago",0
"Haverhill, Lake Saltonstall, First responder, Missing person, Boston",0
WWE NXT,0
"St. Louis Cardinals, Washington Nationals, Willson Contreras",0
"Greg Abbott, Taiwan, Governor of Texas, Asia",5
"Milwaukee Brewers, Major League Baseball All-Star Game, Pitcher, Closer, National League, Baseball, Christian Yelich",0
"Dan Patrick, Acting governor, Greg Abbott, Lieutenant Governor of Texas, Tropical cyclone",5
"France, Jewish people, Marine Le Pen, National Rally, Antisemitism, Israel, Far-right politics",5
"Clayton Kershaw, Los Angeles Dodgers, Pitcher",0
"Shark Week, Discovery Channel, Sharks, John Cena",0
"Sharks, Ageing, Greenland shark, Vertebrate",0
"Serena Williams, Tennis, Hot Ones",0
"Glacier National Park, Drowning, Avalanche Creek, Lake McDonald, Sprague Creek Campground",0
"Bob Menendez, United States Senator",5
"Bethenny Frankel, Paul Bernon, The Real Housewives of New York City, Engagement ring",0
"Puerto Rico men's national basketball team, Basketball, FIBA, FIBA World Olympic Qualifying Tournament",0
"Women's Tennis Association, Tennis, Singapore, Hologic, Association of Tennis Professionals",0
"Tennis, Olympic Games Paris 2024, Novak Djokovic, Rafael Nadal, Andy Murray, Iga Świątek, Coco Gauff",0
"Luka Dončić, Giannis Antetokounmpo, Greece, Olympic Games, Slovenia, Basketball",0
"Wimbledon, Tennis, Renata Zarazúa",0
"Skydance Media, National Amusements, Shari Redstone, David Ellison, Mergers and acquisitions, Paramount Pictures",0
"Shohei Ohtani, Home Run Derby, Los Angeles Dodgers, MLB",0
"Detroit, Mass shooting, Michigan State Police",0
"Chicago White Sox, Miami Marlins, Jake Burger, MLB",0
"British Grand Prix, Formula 1, George Russell, Lewis Hamilton, Silverstone Circuit, Mercedes AMG Petronas F1 Team, Lando Norris, McLaren",0
Rashida Jones,0
"Sporting Kansas City, Colorado Rapids, MLS, Dick’s Sporting Goods Park",0
"Chicago Cubs, St. Louis Cardinals, MLB, Cody Bellinger, Jameson Taillon",0
"Kevin Mayer, Decathlon, Paris, Olympic Games Paris 2024, Diamond League",0
"Minnesota Lynx, Connecticut Sun, WNBA, Napheesa Collier",0
"Mayor, Fox News, Georgia, Fox & Friends, Arabi",5
"New York Mets, Brandon Nimmo, Washington Nationals",0
"San Jose Earthquakes, Chicago Fire FC, MLS, Hugo Cuypers",0
"Drew McIntyre, CM Punk, Money in the Bank ladder match, WWE Monday Night RAW, Seth Rollins, Damian Priest",0
"Joe Biden, Strike action, Philadelphia, Trade union, Harrisburg, National Education Association",5
"Hendrick Motorsports, Hooters, NASCAR, Chase Elliott, NASCAR Cup Series, Restaurant chain, Rick Hendrick",0
"Atlanta Braves, Eddie Rosario, Minor League Baseball, MLB, Washington Nationals",0
"Oakland Athletics, Baltimore Orioles, Brent Rooker, Pitcher",0
"New York Giants, Hard Knocks, Saquon Barkley, NFL, Philadelphia Eagles",0
"Olympic Games, Tiffany Hayes, Olympic Games Paris 2024, 3x3 basketball, Azerbaijan, UConn Huskies women's basketball, Marcedes Walker, WNBA",0
"Pittsburgh Pirates, St. Louis Cardinals, Bryan Reynolds",0
"PGA TOUR, Jordan Spieth, Phil Mickelson",0
"Mineral, Rare-earth element, China, Geology",0
"Real Salt Lake, Houston Dynamo FC, MLS",0
"Sunscreen, Skin cancer",0
"Los Angeles Dodgers, Arizona Diamondbacks, Christian Walker, Dodger Stadium",0
"Wildfire, Wharton State Forest, New Jersey Forest Fire Service, Forest, Batona Campground",0
"Massachusetts, Heat advisory, National Weather Service",0
"Tropical cyclone, Texas",0
"Cleveland Guardians, Josh Naylor, José Ramírez, Kyle Tucker, Carlos Rodón",0
"Douglas Emhoff, Kamala Harris, Second Lady/Gentleman of the United States, Joe Biden",5
"Insurance, Leadership, Financial services, Finance, The Travelers Companies",0
"Sprint, Netflix, Athletics, Track and field, Noah Lyles, Television documentary",0
"Beverly Hills Cop, Eddie Murphy, Axel Foley, Action, Judge Reinhold, Netflix",0
"Hamilton Tiger-Cats, BC Lions, Canadian Football League",0
"Hulu, Television comedy",0
"Wildfire, Colorado",0
"Bitcoin, Mt. Gox, Cryptocurrency exchange",0
