queries,response
"Rudy Giuliani, Donald Trump, Disbarment, Mayor of New York City",5
"Tenerife, Missing person",0
"Robert F. Kennedy Jr., Dog",0
"Red Lobster, Flavor Flav, Public Enemy",0
"Bears, Chatsworth, Los Angeles",0
"Missing person, United States Marshals Service",0
"Tesla, Electric vehicle, NASDAQ:TSLA",0
"Romania national football team, UEFA Euro 2024, Gheorghe Hagi",0
"North Korea, Ballistic missile",0
"Cleveland Cavaliers, Donovan Mitchell, NBA",0
"Stingray, Aquarium & Shark Lab by Team ECCO, Charlotte",0
"Air Europa, Turbulence",0
"Tour de France, Mathieu van der Poel, Tadej Pogačar",0
"Philippines men's national basketball team, Tim Cone, Philippines, FIBA, Basketball",0
"Novak Djokovic, Wimbledon, Tennis",0
"Inflation, European Central Bank, Eurozone, Christine Lagarde",0
Lucy Letby,0
"Hurricane Beryl, Tropical cyclone, Jamaica",0
"Marcelo Bielsa, Uruguay national football team, Copa América, United States men's national soccer team, CONMEBOL",0
"Unidentified flying object, World UFO Day, Extraterrestrial life, 2024",0
"Czech Republic national football team, Türkiye national football team, UEFA Euro 2024, Türkiye",0
"St. Paul Rodeo, Breakaway roping, Saint Paul, Oregon",0
"Netherlands national football team, UEFA Euro 2024, Netherlands, Ronald Koeman",0
"PG&E Corporation, Heat wave, Northern California, Power outage",0
"OpenSSH, Vulnerability, Secure Shell, Arbitrary code execution, Qualys, Common Vulnerabilities and Exposures, Computer security, Linux",0
"Novak Djokovic, Tennis player",0
"India national cricket team, Barbados, Cricket, ICC Men's T20 World Cup, Twenty20, Rohit Sharma, Tropical cyclone",0
"Blake Anderson, Utah State Aggies football, Head coach, Arkansas State Red Wolves football, College Football, American football, Mountain West Conference",0
"Independence Day (United States), Fireworks, July 4, 2024, Illinois",0
"Varanasi, Uttar Pradesh, India, Lucknow, Brajesh Pathak",0
"Kenya, 2024, Protest, Embassy, July 2",0
Marc Jacobs,0
"Central bank, Monetary policy, Fiscal policy, Disinflation, Brazil, Reuters, Inflation, Financial market",0
"Jeffrey Epstein, Grand jury, Florida",5
"European Central Bank, France, Central bank, Finance, Germany",0
Agent Smith,0
"Wildfire, San Diego, Del Mar Heights",0
"Pasig, July 2, Holiday, Bongbong Marcos, Philippines",0
"Rocket, Space launch",0
"Dr. Reddy's Laboratories, Nicotine replacement therapy",0
"Finance, Savings, Financial plan",0
"Luka Dončić, Dallas Mavericks, Slovenia, Basketball, Slovenia men's national basketball team, Olympic Games",0
"Electronic cigarette, Supreme Court of the United States, Food and Drug Administration",5
"Lotology, South Carolina Education Lottery, Scratchcard",0
"Panama national football team, Bolivia national football team, 2024 Copa América, Bolivia",0
"Joey Chestnut, Nathan's Hot Dog Eating Contest, Hot dog, Nathan's Famous",0
"LPGA, Midland Country Club",0
"Japan, Industrial production, Manufacturing",0
"Tim Anderson, Miami Marlins, Chicago White Sox, Shortstop",0
"Gold, Yellowcake, New South Wales, Finance",0
"Stock, Jerome Powell, Interest rate",5
"Rajesh Ranjan, NEET, Lok Sabha, Bihar",0
"Kazakhstan, Astana, 2024",0
"Jensen Huang, Elon Musk, Nvidia, Tesla, Chief Executive Officer",0
"Philippine Football Federation, Philippines",0
"New Orleans, Tropical cyclone",0
"NATO summit, Washington",5
"Pope Francis, Catholic Church",0
"Madhya Pradesh, Income tax, Mohan Yadav, Finance",0
"Shanghai Pudong International Airport, Pudong, Shanghai, Tourism",0
"McDonald's, Garlic sauce",0
"Jamie Foxx, Corinne Foxx",0
"Keg, Forecasting, Drink, The Keg Steakhouse + Bar - Ottawa Market",0
"Al-Shabaab, Uganda, Somali Armed Forces",0
"Costa Rica national football team, Colombia national football team, Colombia, 2024 Copa América",0
"Robot, Robotics",0
"Ziff Davis, Business Wire, Mergers and acquisitions, J2 Global, Media, 2024",0
"London Stock Exchange Group, Dow Jones Industrial Average, Dow Jones & Company, London Stock Exchange, Analytics",0
"Cuba, China",0
"Googly eyes, MBTA, Boston, MBTA subway",0
"Inflation, Europe, Stock, Personal consumption expenditures price index",0
"Nubank, Artificial intelligence, Finance, Hyperplane, Financial services",0
"Cook Out, Inflation, Independence Day (United States)",0
"Pound sterling, Japanese Yen, Foreign Exchange Market, Forecasting",0
"Mangrove, Biology, Ecosystem",0
"Fintech, Deluxe Corporation, Chief Executive Officer, NYSE:DLX, Business Wire, New York Stock Exchange",0
"Tour de France, Lotto–Dstny, Sprinter, Belgium, Road bicycle racing, Grand Tour, Belgian National Road Race Championship, Victor Campenaerts, Jasper Philipsen",0
"Christian Church, Real Estate, Square meter",0
"School, Melbourne, St Margaret Mary’s Catholic Primary School",0
"Osteoporosis, Artificial intelligence, Machine learning, Deep learning, Radiography, Dual-energy X-ray absorptiometry",0
"Bob's Stores, Connecticut, Eastern Mountain Sports",0
"Tatiana Maslany, Regina, Canada, Canada's Walk of Fame, Orphan Black",0
"Pakistan, France, Memorandum of understanding",0
"Evolution Championship Series, Esports, Cygames, 2024",0
"China, Xi Jinping, Xue Qikun, Innovation",0
"Beetlejuice Beetlejuice, Venice Film Festival, Tim Burton, Michael Keaton, Film festival, Winona Ryder, Jenna Ortega",0
"Indonesia, Nickel, Mineral, Sustainability, Industry",0
"Suki Waterhouse, Robert Pattinson, British Vogue",0
"Supreme Court of the United States, Social media, Joe Biden",5
"Cristiano Ronaldo, Penalty kick, UEFA Euro 2024, Portugal national football team, Slovenia national football team",0
"Supreme Court of the United States, Donald Trump, Riot",5
"Bank robbery, Lawrence Police Department, Kansas",0
Tenerife,0
"Delta, Ekpan, Nigeria",0
"Supreme Court of the United States, Assault weapon, Second Amendment to the United States Constitution, Federal Assault Weapons Ban",5
"Northland Power, Solar energy, Mexico",0
"Maryland Terrapins women's basketball, Croatia, Basketball",0
"Duck Donuts, Philippines, Makati",0
"General practitioner, Health care, Virus, New Zealand",0
"Ghana, Energy industry, Matthew Opoku Prempeh, World Bank",0
Efficient energy use,0
"Tempur Sealy International, Tempur-Pedic, Mattress Firm, Federal Trade Commission",0
"Brooklyn, Independence Day (United States), Coney Island",0
"Iraq, Kurdistan Region, Kurdistan Democratic Party, Patriotic Union of Kurdistan, Kirkuk Provincial Council, Mohammed Shia' Al Sudani",0
"The Table Bay hotel, IHG Hotels & Resorts, Cape Town, V&A Waterfront, Sun International Limited, Tourism, Hospitality",0
"Onex Corporation, Insurance, Reinsurance, Mergers and acquisitions",0
"VHS, Computer, Videocassette recorder, DVD",0
"Epic Games, Sunless Skies",0
"Arby's, Potato cake, Potato, Kyle MacLachlan",0
"Nuri Şahin, Borussia Dortmund, Jürgen Klopp, Liverpool F.C., Hans-Joachim Watzke, Head coach",0
"Oklahoma State Cowboys football, Driving under the influence, Running back, College Football",0
"Vaccine, Moderna, Influenza vaccine, H5N1 vaccine",0
"Indonesia, Inflation rate, Consumer price index, June",0
"Netherlands, Dick Schoof, Geert Wilders, Government, Far-right politics",5
"S&P Global, S&P Global Ratings, Economic growth, Emerging market, Export, Asia–Pacific",0
"Frank Stronach, Canada, Belinda Stronach, Magna International",0
"National Australia Bank, Online banking, Downtime",0
"John Deere Classic, PGA TOUR, TPC Deere Run",0
